{
  "$schema": "https://json-schema.org/draft/2020-12/schema",
  "title": "ADT Core Leaf Node",
  "type": "object",
  "required": ["kind", "name"],
  "additionalProperties": false,
  "properties": {
    "kind": { "const": "leaf" },
    "type": {
      "type": "string",
      "enum": ["library", "tool", "guide", "prompt-pack", "schema", "template"],
      "description": "Optional classification for the leaf. Used for documentation and governance conventions."
    },
    "name": { "type": "string", "minLength": 1 },
    "description": { "type": "string" },
    "upgradeVerification": {
      "type": "object",
      "additionalProperties": false,
      "properties": {
        "commands": {
          "type": "array",
          "items": {
            "type": "object",
            "required": ["name", "shell", "command"],
            "additionalProperties": false,
            "properties": {
              "name": { "type": "string" },
              "shell": { "enum": ["powershell", "pwsh", "cmd", "bash"] },
              "cwd": { "type": "string" },
              "command": { "type": "string" }
            }
          }
        }
      }
    }
  }
}
